{
    "id": "outline-parser-v3",
    "name": "大纲解析器 V3",
    "version": "3.0.0",
    "description": "基于LangChain的智能大纲解析，支持多格式大纲导入和章节结构提取",
    "author": "项目组",
    "plugin_type": "analyzer",
    "api_version": "1.0",
    "priority": 100,
    "enabled": true,
    "dependencies": [],
    "conflicts": ["outline-parser-v1", "outline-parser-v2"],
    "permissions": ["file.read"],
    "min_platform_version": "6.0.0",
    "entry_class": "OutlineParserPlugin"
}
